
"",bestworldnewsss,bestworldnews,"
",Tsipras: Greece will seek to mend ties between Russia & EU through European institutions  #worldnews,Wed Apr 08 21:52:45 +0000 2015,1428529965658,585923259536924673,person,0.6726557680407189,recovery_from_illness,0.8785473605468099,other,0.8251049399478224
"",6iracial,xan1738,"somewhere on the west skatin in a jag
",Come thr-u-u-u-u-u-u-u-u-u-u-u-u-u-u-u-u-u-u-u-u-u-u-u-u-u-u-u-u-u-u-u-u-u-u-u-u-u-u-u-u-u-u-u-u-u-u-u-u-u-u-u-u-u-u,Tue Apr 14 00:47:42 +0000 2015,1428972462663,587779226494992384,person,0.9999989064947961,recovery_from_illness,0.9999999999855247,other,0.9999999999999614
"",HiMikiBabe,m i k,"JPN PHL | 16 | Delight yourself to him | mj's
","Sometimes, the only soul that can mend a broken heart is the one that broke it.",Tue Apr 14 14:42:39 +0000 2015,1429022559660,587989348529770496,person,0.7022233504925098,recovery_from_illness,0.7643893262236661,other,0.71481822459801
"",diane16875148,diane,"I've started http://WindingRoadSociety.org and I'm very excited to get it off the ground. I'm putting my Board of Directors together and need Qualified people
","So true, but there can always be someone new in your life to help mend it.... To all of us who have lost a piece... ",Tue May 05 22:29:23 +0000 2015,1430864963662,595716951005093888,person,0.9995874834350703,recovery_from_illness,0.9063073706134143,other,0.9535988433010059