
"",Katillia_,Katia,"I am the flower and the thorns.
","I'm sick of doing the same old things, I'm sick of the same old people",Sat Jun 06 04:27:28 +0000 2015,1433564848658,607041089443229696,person,0.9973980804112863,major_illness,0.9928716220320027,self,0.8142936314221654
"",aidan_west12,aidan west,"
",So sick I'm just pouring sweat sitting in class what the fuck...,Wed Jun 10 14:40:58 +0000 2015,1433947258661,608645033248489473,person,0.9981767748836711,major_illness,0.7825948405111337,self,0.540036239857654
"",hugefuckboy,thurn and praxis,"bad basketball talk and bad everything else too
",I had a heart attack in whataburger today and EMS had to sedate me to get me to leave without my fries. I have a Gadsden flag license plate,Tue Jun 16 18:41:01 +0000 2015,1434480061658,610879770990129152,person,0.9594751729925618,major_illness,0.9928929169270387,self,0.9694297368986975
"",Tilly_Design,Matilda,"Jeweller.
",using a sick day to search for jobs #jobhunting #Helsinki,Tue Jun 23 17:19:08 +0000 2015,1435079948661,613395879446347776,person,0.966684889297144,major_illness,0.5169031752561918,self,0.6470086947044763
"",MlTCHELL123,mitch,"
","guys do i suit this hairstyle??? I'm sick of my normal one its so 2014 now ",Sun Jun 28 18:08:25 +0000 2015,1435514905661,615220221331292161,person,0.9996287276384292,major_illness,0.5942071494215279,self,0.8249225545880353
"",emma_infinity_,"emma becker ","im a mess // aries // she/her // pink green & blue
",I'm such a baby. I'm literally sleeping in my moms room tonight because I'm sick. there's no way I'm really 16 I think I'm actually 5,Thu Jul 02 03:22:34 +0000 2015,1435807354658,616446841329053696,person,0.9999093267922676,major_illness,0.8513991337017384,self,0.9966014495077098
"",Juniper40,Susan Russ,"Librarian, lover of art, nature, travel & good food. Cancer survivor. This is a personal Twitter account.
","I'm pretty independent already, but if I could I'd like to declare independence from this cancer.",Sat Jul 04 18:32:04 +0000 2015,1436034724660,617400500238073858,person,0.997800052642528,major_illness,0.5443297551267492,self,0.8241266214914524
"",martsmoth,Emily,"I'm an angel you ass
",last time I went out alone I got grabbed by some high/drunk woman and I had a panic attack,Wed Jul 08 20:44:06 +0000 2015,1436388246663,618883278989328385,person,0.9979675485955847,major_illness,0.5996777476199213,self,0.8953213888711709
"",tatsnmuscle,Bruh!?!,"IG: imadeitthisfar Kik: misterdmichael  Twitter is entertainment for me... General never specific
",I'm sick of this black ass woman court cop bitch annoying me with things I can and cannot do.,Thu Jul 16 14:51:00 +0000 2015,1437058260664,621693521393618945,person,0.9881295477905051,major_illness,0.4867648488332568,self,0.8782532865114046